{
  "$schema": "../schemas/policy-card.schema.json",
  "id": "interpretability_moonshot",
  "title": "strings:policy.interpretabilityMoonshot.title",
  "body": "strings:policy.interpretabilityMoonshot.body",
  "cost": { "capital": 100, "politicalCapital": 50 },
  "effects": {
    "safetyInsight": 100,
    "talent": -50
  },
  "delayedEffects": [
    {
      "inTurns": 2,
      "effects": { "safetyInsight": 100 }
    }
  ],
  "oncePerRun": true,
  "sourceIds": ["SRC-SCALING-MONOSEMANTICITY", "SRC-SLEEPER"],
  "tags": ["safety", "interpretability", "research"]
}
