{
  "$schema": "../schemas/policy-card.schema.json",
  "id": "ubi_pilot",
  "title": "strings:policy.ubiPilot.title",
  "body": "strings:policy.ubiPilot.body",
  "cost": {
    "politicalCapital": 100,
    "capital": 150
  },
  "effects": {
    "society.unrest": -150,
    "publicTrust": 100
  },
  "delayedEffects": [
    {
      "inTurns": 4,
      "effects": {
        "capital": -150
      }
    }
  ],
  "oncePerRun": true,
  "sourceIds": ["SRC-OPENRESEARCH-UBI", "SRC-IMF-GENAI"],
  "tags": ["society", "labor", "welfare"]
}
