{
  "$schema": "../schemas/policy-card.schema.json",
  "id": "open_weights_release",
  "title": "strings:policy.openWeightsRelease.title",
  "body": "strings:policy.openWeightsRelease.body",
  "cost": {
    "politicalCapital": 50
  },
  "effects": {
    "publicTrust": 150,
    "rival.trust": 50,
    "capability": -100,
    "rival.capability": 150,
    "flags": ["openWeightsWorld"]
  },
  "delayedEffects": [
    {
      "inTurns": 3,
      "effects": {
        "safetyInsight": 100
      }
    }
  ],
  "oncePerRun": true,
  "sourceIds": ["SRC-DEEPSEEK-R1", "SRC-US-POLICY-CHINA-OPEN-ECOSYSTEM"],
  "tags": ["open-weights", "transparency", "diffusion"]
}
